Item ID,document_id,name,sdg13
117663318,11174,Midterm Review of the Strategic Partnership Framework 2017-2020 (SPFII) between Sida and UN Women,0
117669977,10817,Evaluation of the Contribution of Italian Funded Projects to Ending Violence against Women and Promoting Gender Equality in ECOWAS Member States,0
117663684,6152,Climate Change Adaptation Programme in Water and Agriculture in Anseba region,1
117671113,9253,Governance and Public Administration Reform (CPD Outcome 8),0
117661088,11113,"Final External Evaluation of the project ‘Gender equality at the centre of reforms, peace and security’, funded by the Government of Sweden",0
